"Title ID","Title","Annotation","Publisher","Copyright","OriginalCopyright","Translator","Author","Illustrator","Grade Level Span","Language","Genre","Classification","Culture","Topic","Discipline","Standard","Award"
"40452","Chicken Little","The wacky birds that think the sky is falling in this version of the classic tale are full of wild sound effects (awk, onk, oop, eep, ack). Zany and brilliant cut-paper images accompany the sound effects. A giant three-page pullout offers a new twist for a unique ending.","Roaring Brook Press","2009",,,"Rebecca Emberley","Ed Emberley","Preschool/Pre thru K, K thru 2","English","Folklore","Picture Book",,"English-Language Arts/General, Visual Arts","Visual and Performing Arts, English-Language Arts/General ","VAPA V PreK-12.1",
"41341","Chicken Said, ""Cluck!""","Earl and Pearl are planting pumpkins. Chicken wants to help. But it seems like the only thing Chicken is good at is getting in the way.

Then grasshoppers invade the pumpkin patch, and Earl and Pearl can do nothing to stop them. Suddenly it's up to Chicken to save the day!

","HarperCollins","2008",,,"Judyann Grant","Sue Tresdell","Preschool/Pre thru K, K thru 2","English","Fiction","Early Chapter Book",,"English-Language Arts/General","English-Language Arts/General ",,"Theodor Seuss Geisel Award"
"40526","City Dog, Country Frog","Spare, rhythmic text and expressive watercolor illustrations tell a poignant and sometimes humorous story about friendship and the seasons of life. In the spring, City Dog discovers Country Frog. They become fast friends, playing games that suit them both. By the following spring, Country Frog is gone and Country Squirrel appears instead. This story gently addresses the natural cycle of life.","Hyperion Books for Children","2010",,,"Mo Willems","Jon J. Muth","Preschool/Pre thru K, K thru 2","English","Fiction","Picture Book",,"English-Language Arts/General, Global Social Issues","English-Language Arts/General ",,
"2680","City Lullaby","A baby in a stroller sleeps despite loud city noises—10 horns beeping, two motorbikes roaring, and other noises—until the soft chirp of one sparrow awakens the child. Rhyming poetry with onomatopoetic words enhances this counting book that focuses on the sounds in a city.","Clarion","2007",,,"Marilyn Singer","Carll Cnuet","Preschool/Pre thru K, K thru 2","English","Fiction in Verse","Counting Book, Picture Book",,"Music","Visual and Performing Arts","VAPA M PreK-12.2",
"654","City Signs","Presents an introduction to the concept of city signs and a collection of photographs of different signs found in various locations—street signs, road signs, and signs on buildings, windows, and people. The reader can discover 30 colorful photographs or city signs that are a part of the everyday world. Early readers will enjoy being able to read familiar signs.","Kids Can Press","2002",,,"Zoran Milich","Zoran Milich","Preschool/Pre thru K, K thru 2","English","Nonfiction","Picture Book, Read Aloud",,"Geography, Visual Arts","History/Social Science","HSS K.4",
"15263","Color Zoo","Bright illustrations on die-cut pages form animal faces when placed on top of one another. This colorful format uses basic geometric shapes to create a way to introduce or reinforce concepts of shape and color.","HarperCollins","1989",,,"Lois Ehlert","Lois Ehlert","Preschool/Pre thru K, K thru 2","English","Nonfiction","Concept Book, Picture Book",,"Measurement & Geometry (Geometry)","Visual and Performing Arts, Mathematics","VAPA V PreK-12.1, Math K.MD.1-4, Math 1.MD.1-4","Caldecott Honor"
"1229","Cookies: Bite-Size Life Lessons","Simple text and illustrations describe lessons in life as a young girl bakes cookies and learns cooperation, patience, pride, compassion, trust, and more. Lovely pastel watercolor illustrations show children and animals interacting with one another and the treats.","HarperCollins","2006",,,"Amy Krouse Rosenthal","Jane Dyer","Preschool/Pre thru K, K thru 2","English","Fiction","Concept Book, Picture Book, Read Aloud","Multicultural","Diversity, English-Language Arts/General","History/Social Science","HSS K.1, HSS 1.1",
"2584","Cool Time Song","After a hot day on the African savannah, the animals begin to move and make sounds in the cool air of evening. The addition of percussion instruments to accompany the animals’ “songs” or to create an original song will enhance the story. The book is also useful for introducing lessons on colors and lines in visual art.","Viking","2005",,,"Carole Lexa Schaefer","Pierr Morgan","Preschool/Pre thru K, K thru 2","English","Fiction","Picture Book",,"Music, Visual Arts","Visual and Performing Arts","VAPA M PreK-12.2, VAPA M PreK-12.3, VAPA V PreK-12.1",
"41048","Cora Cooks Pancit","This book features a Filipino family that cooks together. Cora likes cooking and would love the chance to bond with Mama in the kitchen, but Cora is always relegated to doing the “kid jobs.” When Cora’s siblings get busy with other activities, she finally gets a chance to cook pancit with her mother. The family’s loving relationship is highlighted by the warm tones of the illustrations. A good read-aloud choice.","Shen’s Books","2009",,,"Dorina K. Lazo Gilmore","Kristi Valiant","Preschool/Pre thru K, K thru 2","English","Realistic Fiction","Picture Book, Read Aloud","Filipino/Filipino American","Diversity, English-Language Arts/General, Lifestyles Around the World, Nutrition and Physical Activity","World Language, English-Language Arts/General , Literacy/Motivation",,
"40194","Counting Our Way to Maine","On a trip from the city to the coast of Maine, a family of five, with two dogs, counts from 1 (a baby) to 20 (fireflies). More than just a counting book, this is also a lively vacation story. The bright mixed-media artwork is filled with details that children will enjoy.","Down East Books","2008","1995",,"Maggie Smith","Maggie Smith","Preschool/Pre thru K, K thru 2","English","Fiction","Counting Book, Picture Book",,"Mathematics, Number Sense","Mathematics","Math K.CC.1-7, Math 1.NBT.1-6",
"40024","Cow Who Clucked, The","Cow wakes up one morning and discovers that she has lost her “moo.” She meanders through the barnyard, where she encounters several animals and discovers that the hen is imitating her voice. Double-page spreads featuring handmade paper artwork show the animals in rich, vivid colors.","Henry Holt and Company","2006",,,"Denise Fleming","Denise Fleming","Preschool/Pre thru K, K thru 2","English","Fiction","Picture Book",,"English-Language Arts/General","English-Language Arts/General ",,
"41334","Dance Like Starlight, A: One Ballerina’s Dream","Little ballerinas have big dreams. But in Harlem in the 1950s, dreams don't always come true—they take a lot of work and a lot of hope. And sometimes hope is hard to come by. But the first African-American prima ballerina, Janet Collins, did make her dreams come true. And those dreams inspired ballerinas everywhere, showing them that the color of their skin couldn't stop them from becoming a star. ","Philomel","2014",,,"Kristy Dempsey","Floyd Cooper","Preschool/Pre thru K","English","Fiction","Picture Book",,"Dance, English-Language Arts/General","Visual and Performing Arts, English-Language Arts/General ",,"Golden Kite Author Winner"
"41448","Dear Primo: A Letter to My Cousin","This is the story of two cousins, one in America and one in Mexico, and how their daily lives are different yet similar. Charlie takes the subway to school; Carlitos rides his bike. Charlie plays in fallen leaves; Carlitos plays among the local cacti. ","Harry N. Abrams","2010",,,"Duncan Tonatiuh","Duncan Tonatiuh","Preschool/Pre thru K, K thru 2","English, Spanish/English","Fiction","Picture Book, Read Aloud","Multicultural","English-Language Arts/General","English-Language Arts/General ",,"Pura Belpre Illustration Honor"
"41231","Deserts","Part of the “About Habitats” series, this book introduces young readers to deserts. Large paintings depict the plants and animals in a particular desert landscape. The locale and featured plants and animals are identified. A brief line of text comments on deserts, their characteristics, and the types of life found in them. The book includes a map with locations of major deserts around the world, an afterword featuring color plates and a paragraph of related information, a glossary, and short lists of related books and Web sites.","Peachtree Publishers","2012",,,"Cathryn P. Sill","John Sill","Preschool/Pre thru K, K thru 2","English","Narrative Nonfiction, Nonfiction","Picture Book, Read Aloud",,"Life Science (Biology)","English-Language Arts/General , Science","LS K.2, LS 1.2, LS 2.2",
"299","Dig Dig Digging","Simple rhymes introduce various large vehicles, such as dump trucks, fire engines, and tractors, and describe the work accomplished with each vehicle type.","Henry Holt","2001",,,"Margaret Mayo","Alex Ayliffe","Preschool/Pre thru K","English","Fiction","Picture Book, Read Aloud",,"American History, Economics","History/Social Science","HSS K.3",
"40466","Dinotrux","In this far-fetched story, giant construction vehicles from present times—such as trucks, cement mixers, and cranes—take on the roles of destructive and ferocious prehistoric reptilians: dinotrux (the ruler), garbageadon, cementosaurus, cranosaurus, and firesaurus. Millions of years later, they “shed their teeth, their toenails, and their misbehaving ways” and evolve into modern construction vehicles. Cave people appear throughout the book, and endpapers show the transformation from old to new.","Little, Brown and Company","2009",,,"Chris Gall","Chris Gall","Preschool/Pre thru K, K thru 2","English","Fiction","Picture Book",,"English-Language Arts/General","English-Language Arts/General ",,
"40566","Dog and Bear: Three to Get Ready","In simple sentences and with colorful illustration, this book depicts two friends, Bear and Dog, who get involved in all sorts of tricky situations. Each of the three comic-like vignettes starts with a curious picture, enticing the reader to turn the page and get to the next scene. Use as a read-aloud or for independent beginning readers.","Roaring Brook Press","2009",,,"Laura Vaccaro Seeger","Laura Vaccaro Seeger","Preschool/Pre thru K, K thru 2","English","Fiction, Humor","Easy Reader, Picture Book",,"English-Language Arts/General","English-Language Arts/General ",,
"41370","Don't Throw It to Mo!","Mo is the youngest kid on the Robins, his football team. His classmates don't mind, but the kids on their rival team tease him for being a ""butterfingers"" who's too tiny to catch the ball. But Mo's coach has a plan to turn Mo's little size into a big win for the Robins!","Penguin Group","2015",,,"David A. Adler","Sam Ricks","Preschool/Pre thru K, K thru 2","English","Fiction","Easy Reader",,"English-Language Arts/General, Motor Skills/Movement Patterns","Physical Education, English-Language Arts/General ",,"Theodor Seuss Geisel Award"
"2588","Dooby Dooby Moo","While Farmer Brown sleeps, his animals prepare for a talent show at the county fair, where they hope to win a trampoline. To keep the animals out of trouble, Farmer Brown loads them into his pickup truck, but they sneak away and enter the talent show. The results are mixed. Illustrated with energetic watercolor artwork. Children will want to sing along with the animals as they rehearse.","Atheneum Books for Young Readers","2006",,,"Doreen Cronin","Betsy Lewin","Preschool/Pre thru K, K thru 2","English","Fiction, Humor","Picture Book, Read Aloud",,"Music","Visual and Performing Arts","VAPA M PreK-12.2, VAPA M PreK-12.3",
"39666","Dot","Bright dots, big dots, small dots, black dots—dots of all kinds are the main characters in this rhyming story that illustrates antonyms and synonyms. A big yellow dot on a blue background represents the sun, a green dot means go, and a red dot means stop. Simplicity at its best, this story ends with a white dot on a black background representing the moon, with small dots sparkling in the sky.","Farrar, Straus and Giroux","2011",,,"Patricia Intriago","Patricia Intriago","Preschool/Pre thru K, K thru 2","English","Fiction, Fiction in Verse","Concept Book, Picture Book",,"English-Language Arts/General","English-Language Arts/General , English-Language Arts/Vocabulary",,
"2603","Down by the Station","In this spirited version of a familiar song, baby animals ride to the children’s zoo on the zoo train. As each animal gets on board, appropriate animal sounds are introduced. Visual clues hint at which animal will be picked up next. Illustrated with bright, motion-filled artwork.","Gulliver Books/Harcourt Brace","1999",,,"Will Hillenbrand","Will Hillenbrand","Preschool/Pre thru K, K thru 2","English","Fiction in Verse","Picture Book, Read Aloud","Multicultural","Music","Visual and Performing Arts","VAPA M PreK-12.2, VAPA M PreK-12.3",
"2678","Dragon Dancing","After learning about dragons at school and making their own from paper and feathers, classmates are whisked away to a magical world where they collectively become a dragon. This book has few words on each page and lively illustrations.","Viking","2007",,,"Carole Lexa Schaefer","Pierr Morgan","Preschool/Pre thru K, K thru 2","English","Fiction","Picture Book, Read Aloud",,"Dance, Visual Arts","History/Social Science, Visual and Performing Arts","VAPA D PreK-12.2, HSS 1.5, VAPA V PreK-12.2",
"41340","Drum Dream Girl","Girls cannot be drummers. Long ago on an island filled with music, no one questioned that rule until the drum dream girl came along. In her city of drumbeats, she dreamed of pounding tall congas and tapping small bongos. She had to keep quiet. She had to practice in secret. But when at last her dream-bright music was heard, everyone sang and danced and decided that both girls and boys should be free to drum and dream.

This story is inspired by the childhood of Millo Castro Zaldarriaga, a Chinese-African-Cuban girl who broke Cuba's traditional against female drummers.","Houghton Mifflin Harcourt","2015",,,"Margarita Engle","Raul Lopez","Preschool/Pre thru K, K thru 2","English","Biography/Autobiography, Fiction","Picture Book","Latino/Latino American","English-Language Arts/General","English-Language Arts/General ",,"Pura Belpre Illustration Winner"
"437","Duck for President","Duck gets tired of working for Farmer Brown on the farm and decides to campaign for control of the farm. His political ambition leads to his being elected president, but he quickly learns that running the government is not much fun. He retires to write his memoirs, graduating from a typewriter to a computer. This is a deliciously funny read-aloud that helps to present the concepts of elections, voting, campaigns, citizen responsibility, and why candidates run for office.","Simon & Schuster Books for Young Readers","2004",,,"Doreen Cronin","Betsy Lewin","Preschool/Pre thru K, K thru 2","English","Fiction","Picture Book, Read Aloud",,"Government and Politics","History/Social Science","HSS K.1, HSS 1.1, HSS 2.3",
"40467","Duck! Rabbit!","Is the character that appears in this book a duck or a rabbit? There is a difference of opinion, as stated in the dialogue. Despite the visual clues on each page, the character’s “identity” is open to interpretation. This book’s simple design, humorous text, and elements of curiosity provide opportunities for interaction.","Chronicle Books","2009",,,"Amy Krouse Rosenthal","Tom Lichtenheld","Preschool/Pre thru K, K thru 2","English","Fiction","Picture Book",,"English-Language Arts/General","English-Language Arts/General ",,
"41221","Eggs 1, 2, 3: Who Will the Babies Be?","This unique book offers a potpourri of learning opportunities—counting eggs of 10 animal classes, guessing from clues in short verses what might hatch, learning about birthing environments, associating names with newborns, and discovering facts about animals and nature. Textured paper and fabric constitute the background for the cut-paper collages on two-page spreads, with one being a foldout or flip-up revealing the hatchling. The final page displays all the eggs and compares their sizes.","Blue Apple Books","2012",,,"Janet Halfmann","Betsy Thompson","Preschool/Pre thru K, K thru 2","English","Narrative Nonfiction, Nonfiction","Picture Book",,"English-Language Arts/General, Life Science (Biology), Number Sense","English-Language Arts/Vocabulary, Mathematics, Science","LS K.2, Math K.CC.1-7",
"40503","Farm","The activities on a busy family farm are described through the seasons of the year, from the spring when preparations for planting begin, to the autumn when the cats grow winter coats and the cold rains begin to fall. Many details of farm life are provided, including the buildings, plantings, animals, chores, and the changing weather. Lyrical text and large, watercolor-and-pencil illustrations create a realistic story that works well as a read-aloud.","Orchard Books","2010",,,"Elisha Cooper","Elisha Cooper","Preschool/Pre thru K, K thru 2","English","Fiction","Picture Book, Read Aloud",,"English-Language Arts/General, Lifestyles Around the World","English-Language Arts/General ",,
"41369","Farmer and the Clown","A baby clown is separated from his family when he accidentally bounces off their circus train and lands in a lonely farmer's vast, empty field. The farmer reluctantly rescues the little clown, and over the course of one day together, the two of them make some surprising discoveries about themselves—and about life!
","Beach Lane Books","2014",,,"Marla Frazee","Marla Froze","Preschool/Pre thru K, K thru 2","English","Fiction","Wordless Book",,"English-Language Arts/General","English-Language Arts/General ",,"Golden Kite Illustration Honor"
"40588","First the Egg","Brief text, with vibrant artwork incorporating well-placed die cuts, clearly describes familiar transformations in nature. The text extends to concepts such as “First the word, then the story” and “First the paint, then the picture” and concludes with an illustration that brings together all of the presented transformations.","Roaring Brook Press","2007",,,"Laura Vaccaro Seeger","Laura Vaccaro Seeger","Preschool/Pre thru K, K thru 2","English","Nonfiction","Picture Book, Read Aloud",,"Life Science (Biology)","Science",,
"41088","Friends: True Sories of Extraordinary Animal Friendships","Unlikely animal friendships abound throughout the world and are portrayed in warm, full-color photographs. Simple rhyming text accompanies the photos, and further information is provided in paragraphs that are appropriate for older readers. The book may serve as a platform for talking about diversity and compatibility—not only among animals, but also among humans.","Houghton Mifflin","2011",,,"Catherine Thimmesh",,"Preschool/Pre thru K, K thru 2","English","Nonfiction","Photo Essay, Picture Book",,"Life Science (Biology)","Science","LS 5.2","Eureka! Nonfiction Children’s Book Award Honor"
"2643","Frog Went A-Courtin’","Illustrates the well-known American folk song about the courtship and marriage of a brave frog and a coy little mouse. The fanciful and muted watercolor illustrations made this book the winner of a Caldecott award in 1956.","Harcourt Brace","1983","1955",,"John Langstaff","Feodor Rojankovsky","Preschool/Pre thru K, K thru 2","English","Fiction in Verse","Picture Book, Read Aloud",,"Music","Visual and Performing Arts","VAPA M PreK-12.3","Caldecott Winner"
"854","Giant Hug, The","Owen wants to send his granny a hug for her birthday. He and his mother go to the post office, where he gives a giant hug and granny’s address to the person behind the counter. The hug travels across the country by truck, plane, and mail, demonstrating how the mail travels across the country and the individuals involved in getting it from sender to receiver. Humorous animal characters make this an appropriate story for young listeners.","Alfred A. Knopf","2005",,,"Sandra Horning","Valeri Gorbachev","Preschool/Pre thru K, K thru 2","English","Fiction","Picture Book, Read Aloud",,"Geography","History/Social Science","HSS K.3, HSS 1.6",
"2580","Going to the Zoo","Enthusiastic siblings describe the animals at the “zoo, zoo, zoo” in Tom Paxton’s well-known children’s song. Lyrics and bright watercolor illustrations make this a good read-aloud or sing-aloud choice. Includes the music and lyrics on endpapers.","Morrow Junior Books","1996",,,"Tom Paxton","Karen Schmidt","Preschool/Pre thru K, K thru 2","English","Nonfiction","Picture Book",,"Music","Visual and Performing Arts","VAPA M PreK-12.2",
"39673","Goodnight, Goodnight, Construction Site","This goodnight poem presents five big construction vehicles—Crane Truck, Cement Mixer, Dump Truck, Bulldozer, and Excavator—as they finish their work at the end of the day and settle down for the night. Comical oil-and-pastel illustrations depict close-ups of trucks, scenes of the construction site, and the city skyline at dusk. A repeated refrain will encourage participation. A good read-aloud choice.","Chronicle Books","2011",,,"Sherry Duskey Rinker","Tom Lichtenheld","Preschool/Pre thru K, K thru 2","English","Fiction in Verse, Poetry","Picture Book, Read Aloud",,"English-Language Arts/General","English-Language Arts/General , Literacy/Motivation",,
"1011","Gossie","Gossie is a gosling who likes to wear bright red boots every day, no matter what she is doing. When Gossie’s boots go missing, she is heartbroken, as she can’t find them anywhere. Eventually, however, the boots turn up. The book’s spare but charming illustrations are full of personality.","Houghton Mifflin","2002",,,"Olivier Dunrea","Olivier Dunrea","Preschool/Pre thru K, K thru 2","English","Fiction","Picture Book, Read Aloud",,"Mental, Emotional, and Social Health, Psychology/Sociology","History/Social Science","HSS K.1, HSS 1.1",
"1010","Gossie and Gertie","Gossie and Gertie are best friends. Everywhere Gossie goes, Gertie goes, too—except when she doesn’t, and sometimes that’s even better. Illustrated with charming portraits of the geese, and filled with personality and humor, this is an appealing story of young friendship.","Houghton Mifflin","2002",,,"Olivier Dunrea","Olivier Dunrea","Preschool/Pre thru K, K thru 2","English","Fiction","Picture Book, Read Aloud",,"Mental, Emotional, and Social Health, Psychology/Sociology","History/Social Science","HSS K.1, HSS 1.1",
"39713","Gracias (Thanks)","A young biracial boy expresses gratitude in two languages for the many people and things that enrich his life. He takes nothing for granted. The text is highlighted with bright, cheerful acrylic artwork that resembles folk art. At the end, the author challenges children to think about the things for which they are thankful.","Lee & Low","2009",,,"Pat Mora","John Parra","Preschool/Pre thru K, K thru 2","Spanish/English","Fiction","Concept Book, Picture Book, Read Aloud","Latino/Latino American, Multicultural","Diversity, English-Language Arts/General, Lifestyles Around the World","Literacy/Motivation",,
"40191","Grandpa Gazillion’s Number Yard","Numbers are not just for counting. Focusing largely on the look and shape of numerals, Grandpa Gazillion shows different uses for the numbers 1 to 20 at his number yard. Humorous rhymed couplets and colorful acrylic illustrations help to reinforce number recognition and counting and provide a playful experience with mathematics.","Henry Holt and Company","2005",,,"Laurie Keller","Laurie Keller","Preschool/Pre thru K, K thru 2","English","Fiction, Fiction in Verse","Picture Book, Read Aloud",,"Mathematics, Number Sense","Mathematics","Math K.CC.1-7, Math 1.NBT.1-6",
"40512","Green","This rich encounter features all the flavors of green and uses only 17 adjectives—two of which are hidden—in the rhyming text. As the reader browses forward and then back to the front of the book through the vibrant oil canvases, the meaning and interconnectedness of the clever die cuts come together. Many concepts can be gleaned from this book, including a pro-environmental theme for older readers.","Roaring Brook Press","2012",,,"Laura Vaccaro Seeger","Laura Vaccaro Seeger","Preschool/Pre thru K, K thru 2","English","Fiction, Poetry","Concept Book, Picture Book",,"English-Language Arts/General, Visual Arts","Visual and Performing Arts, English-Language Arts/General ","VAPA V PreK-12.1",
"1384","Harold and the Purple Crayon","One evening, Harold decides to go on a moonlit walk. Fortunately, he has brought his purple crayon. Because there is no moon, Harold uses the crayon to draw one. He needs something to walk on, so he draws a path. After an evening of adventure he is tired and goes home. The simplicity of this story is a perfect choice for young children.","HarperCollins","1983","1955",,"Crockett Johnson","Crockett Johnson","Preschool/Pre thru K","English","Fiction","Picture Book, Read Aloud",,"Visual Arts","Visual and Performing Arts","VAPA V PreK-12.2",
"2336","Harriet Dancing","On her way to her friend Igor’s house, Harriet the hedgehog stops to watch the butterflies dance and then joins in. She is told that the butterfly dance is only for butterflies. Crestfallen, she continues on to Igor’s house and, on the way, falls and rolls down a hillside covered with flowers that stick to her. Igor offers to dance with her and begins by covering himself with flowers. They dance away—and soon the butterflies join them. Illustrated with bold and bright collage artwork.","Chicken House/Scholastic","2008",,,"Ruth Symes","Caroline Church","Preschool/Pre thru K, K thru 2","English","Fiction","Picture Book, Read Aloud",,"Dance","Visual and Performing Arts","VAPA D PreK-12.1, VAPA D PreK-12.4, VAPA D PreK-12.5",
