"Title ID","Title","Annotation","Publisher","Copyright","OriginalCopyright","Translator","Author","Illustrator","Grade Level Span","Language","Genre","Classification","Culture","Topic","Discipline","Standard","Award"
"39689","Harry and Hopper","When his playful dog Hopper is killed in an accident, Harry must learn to say good-bye. At first, Harry is overcome with sadness, but when a ghostly Hopper returns to play each night, Harry slowly learns to cope with his pet’s death. A poignant ending brings comfort. Includes gentle illustrations and soft colors to help young readers deal with loss.","Feiwel and Friends","2011",,,"Margaret Wild","Freya Blackwood","Preschool/Pre thru K, K thru 2","English","Fiction","Picture Book",,"Mental, Emotional, and Social Health, Psychology/Sociology","English-Language Arts/General ",,
"2141","He’s Got the Whole World in His Hands","The lyrics of this familiar spiritual are illustrated with lively images and inspiring scenes of families, communities, and forces of nature. As each page is turned, a line of verse is presented with a fresh, thought-provoking interpretation of the song that will stir the imagination and spark discussion. The book’s striking artwork was done with pencils, oils, and watercolors. Includes the music and four verses of the song.","Dial","2005",,,"Kadir Nelson","Kadir Nelson","Preschool/Pre thru K, K thru 2","English","Nonfiction, Poetry","Picture Book, Read Aloud","Black/African American","Music","Visual and Performing Arts","VAPA M PreK-12.1, VAPA M PreK-12.2, VAPA M PreK-12.3, VAPA M PreK-12.4, VAPA M PreK-12.5",
"41116","Help Me Learn Addition","Simple counting and beginning addition are featured in this colorful title. The short, rhyming text provides direction, while the photos of small objects offer opportunities for children to count or to add. Includes suggestions for adults about how they can help preschoolers grasp the concept of addition as the children count objects.","Holiday House","2012",,,"Jean Marzollo","Chad Phillips","Preschool/Pre thru K, K thru 2","English","Nonfiction","Concept Book, Picture Book",,"Number Sense","Mathematics",,
"39851","Hooray for Amanda & Her Alligator!","Alligator is an impatient, fun-loving stuffed animal and the star of this book. The six and a half short stories capture the ups and downs of Alligator’s friendship with his best friend, Amanda. Everyday emotions touch on boredom, surprise, disappointment, and jealousy. The spare artwork is drawn in grainy black crayon with watercolor wash. A good read-aloud choice.","HarperCollins","2011",,,"Mo Willems","Mo Willems","Preschool/Pre thru K, K thru 2","English","Humor, Short Story","Easy Reader, Read Aloud",,"English-Language Arts/General","English-Language Arts/General ",,
"1911","Hop Jump","Bored with hopping and jumping, a frog discovers dancing and teaches her friends to dance as well. These “frog hopsters” are joyous to behold. This appealing book is also available in a Spanish edition: SALTA Y BRINCA.","Harcourt Brace","1996","1993",,"Ellen Stoll Walsh","Ellen Stoll Walsh","Preschool/Pre thru K, K thru 2","English","Fiction","Picture Book, Read Aloud","Western European","Dance","Visual and Performing Arts","VAPA D PreK-12.1, VAPA D PreK-12.2",
"40292","House in the Night, The","This spare, cumulative story welcomes readers inside the house, where they find a light, a bed within the light, a book on that bed, and a bird inside that book. Black-and-white scratchboard illustrations with accents of glowing yellow enhance this soothing, rhythmic nighttime tale.","Houghton Mifflin","2008",,,"Susan Marie Swanson","Beth Krommes","Preschool/Pre thru K, K thru 2","English","Fiction","Picture Book, Read Aloud",,"English-Language Arts/General","English-Language Arts/General ",,"Caldecott Winner"
"40841","House in the Woods, A","Moose and Bear move into and accidentally destroy a pair of houses already occupied by two pigs. For the price of peanut-butter sandwiches, the four new friends hire beavers to build a house for all of them. Large, expressive pencil, pastel, and wash illustrations depict these animals and the picturesque woodland setting in a tale of friendship and cooperation.","Candlewick Press","2011",,,"Inga Moore","Inga Moore","Preschool/Pre thru K, K thru 2","English","Fiction","Picture Book",,"English-Language Arts/General","English-Language Arts/General , Literacy/Motivation",,
"40257","How Do You Count a Dozen Ducklings?","A mother duck must keep track of 12 ducklings. She finds different ways to group them for easier counting: by twos, by fours, and by threes. Cartoon-style art in soft pastel tones accompanies the text. The book explores different ways of counting, as well as bridges to beginning conceptions of multiplication—such as skip counting and equal groupings.","Albert Whitman and Company","2006","1999",,"In-son Chae","Seung Ha Rew","Preschool/Pre thru K, K thru 2","English","Fiction in Verse","Counting Book, Picture Book, Read Aloud",,"Mathematics, Number Sense","Mathematics","Math K.CC.1-7, Math 1.NBT.1-6, Math 2.OA.1-6, Math 2.NBT.1-9, Math 3.OA.1-9",
"40746","How Many Baby Pandas?","Each two-page spread features full-color photographs of baby panda bears to be counted. Information about the panda’s first year of life is highlighted; the book discusses what cubs eat, how they play, and why they nap, among other topics. Helpful as a counting book and for information about pandas. The baby pandas were photographed at the Giant Panda Breeding Reserve in Wolong, China. Information about its breeding program is included.","Walker and Company","2009",,,"Sandra Markle",,"Preschool/Pre thru K, K thru 2, 3 thru 5","English","Nonfiction","Counting Book, Photo Essay","Chinese/Chinese American","Life Science (Biology), Number Sense","Mathematics, Science","LS 2.2, LS 3.3","Orbis Pictus Award"
"40531","How to Heal a Broken Wing","In a bustling urban setting, no one notices the wounded pigeon on the sidewalk except for young Will. He insists on taking the bird home, where he and his parents carefully tend to the bird’s needs. Sparse wording and detailed pen-and-ink and watercolor drawings tell a sensitive and affirming story.","Candlewick Press","2008",,,"Bob Graham","Bob Graham","Preschool/Pre thru K, K thru 2","English","Fiction","Picture Book, Read Aloud",,"English-Language Arts/General, Life Science (Biology)","English-Language Arts/General ",,
"1036","Human Alphabet, The","The internationally renowned Pilobolus dance company brings to life the twenty-six letters of the alphabet. Ingenious grips, bends, and twists of the human form portray each letter in photographs. In a spirit of pure fun and experimentation, the agile dancers celebrate creativity, the body, and the human alphabet.","Roaring Book Press","2005",,," Pilobolus","John Kane","Preschool/Pre thru K, K thru 2, 3 thru 5","English","Humor, Nonfiction","Alphabet Book, Photo Essay","Multicultural","Dance","Visual and Performing Arts","VAPA D PreK-12.1, VAPA D PreK-12.2",
"1013","I Ain’t Gonna Paint No More","In the spirit of the folk song “It Ain’t Gonna Rain No More,” a child who loves to paint walls—and everything else he sees—cannot resist adding one more dab of paint in some surprising places. Illustrated with artwork that will keep children giggling. Sing it as you read aloud, and the children will beg for more.","Harcourt, Inc.","2005",,,"Karen Beaumont","David Catrow","Preschool/Pre thru K, K thru 2","English","Fiction in Verse","Picture Book, Read Aloud",,"Music, Visual Arts","Visual and Performing Arts","VAPA M PreK-12.2, VAPA V PreK-12.2",
"41506","I Broke My Trunk","Gerald tells Piggie the long, crazy story about breaking his trunk. Will Piggie end up with a long, crazy story of her own?","Hyperion","2011",,,"Mo Willems","Mo Willems","Preschool/Pre thru K, K thru 2","English","Humor","Easy Reader, Picture Book",,"English-Language Arts/General","English-Language Arts/General ",,"Theodor Seuss Geisel Award"
"39701","I Broke My Trunk!","Elephant tells his best friend Piggie the long, complicated story about how he broke his trunk. Their humorous and engaging back-and-forth dialogue is accompanied by Willems’s signature minimalist artwork using pastel colors on an uncluttered background. This hilarious read-aloud is an excellent text for emerging readers.","Hyperion Books for Children","2011",,,"Mo Willems","Mo Willems","Preschool/Pre thru K, K thru 2","English","Fiction, Humor","Easy Reader, Read Aloud",,"English-Language Arts/General","English-Language Arts/General , Literacy/Motivation",,"Theodor Seuss Geisel Award"
"39668","I Call My Grandma Nana","In this rhyming picture book, Wolff features a group of students in a multicultural class. Each student shares stories about his or her grandmother. The reader learns different cultural names for grandmothers: Nai-Nai, Naani, Bubbe, Abuelita, and so on. Grandmothers are displayed in a positive light and are described as leading active, vibrant lives.","Tricycle Press","2009",,,"Ashley Wolff","Ashley Wolff","Preschool/Pre thru K, K thru 2, 3 thru 5","English","Realistic Fiction","Picture Book","Multicultural","Diversity","English-Language Arts/General ",,
"870","I Like Your Buttons!","When a little girl compliments her teacher about the buttons on her outfit, it starts a chain reaction of goodwill, good deeds, and thoughtfulness throughout the day.","Albert Whitman and Company","1999",,,"Sarah Marwil Lamstein","Nancy Cote","Preschool/Pre thru K, K thru 2","English","Fiction","Picture Book","Multicultural","Mental, Emotional, and Social Health","History/Social Science","HSS K.1, HSS 1.2",
"41123","I Love the Alphabet","This book uses colorful backgrounds and collage artwork to pull the reader directly into learning the alphabet. Uppercase and lowercase letters partner with rhyming couplets that are alliterative and refer to the animals featured on each page. A good choice for emerging readers.","Brown Dog Books","2004",,,"Dar Hosta","Dar Hosta","Preschool/Pre thru K, K thru 2","English","Fiction in Verse","Alphabet Book, Picture Book, Read Aloud",,"English-Language Arts/General","English-Language Arts/General , English-Language Arts/Vocabulary",,
"40968","I Spy with My Little Eye","This die-cut picture book features the children’s guessing game, “I spy with my little eye.” Using key colors and descriptions of characteristics, children guess the identity of a variety of familiar animals. The author presents an open-ended opportunity for children to extend the game to their own descriptions of animals or other objects. The repeated pattern can be used to practice both oral and written language.","Templar Books","2011",,,"Edward Gibbs","Edward Gibbs","Preschool/Pre thru K, K thru 2","English","Nonfiction","Picture Book",,"Life Science (Biology)","English-Language Arts/Literary Elements, English-Language Arts/Vocabulary, English-Language Arts/Writing, Literacy/Motivation, Science",,
"39716","I Want My Hat Back","When a bear loses his hat, he asks many animals if they have seen it, but no one has. Just as the bear is about to give up, he remembers where he has seen his hat, and the unlucky animal wearing it is in for an unpleasant surprise. The text has subtle comedy and moves at a perfect pace. Children who infer the ending are sure to chuckle. A good read-aloud choice.","Candlewick Press","2011",,,"Jon Klassen","Jon Klassen","Preschool/Pre thru K, K thru 2","English","Fiction, Humor","Picture Book, Read Aloud",,"English-Language Arts/General","English-Language Arts/General ",,
"2673","It's Not Fair","A variety of children, animals, creatures, and objects all wonder why life is not always fair. Using humor and rhyming text, this book presents a host of complaints—for example, “Why did I get the smaller half?”—that acknowledges the universal sense that sometimes things just don’t seem fair.","HarperCollins","2008",,,"Amy Krouse Rosenthal","Tom Lichtenheld","Preschool/Pre thru K, K thru 2","English","Fiction","Picture Book, Read Aloud",,"American History","History/Social Science","HSS K.1, HSS 1.1",
"2492","Jake the Philharmonic Dog","Tells the story of Jake the dog, who accompanies a New York Philharmonic stagehand to work and becomes a hit with the musicians and the audience. He learns all about the orchestra and the instruments. The story is illustrated in crayon-bright colors.","Walker & Co.","2006",,,"Karen LeFrak","Marcin Baranski","Preschool/Pre thru K, K thru 2","English","Fiction","Picture Book, Read Aloud",,"Music","Visual and Performing Arts","VAPA M PreK-12.1, VAPA M PreK-12.3",
"2681","Jazz Baby","When Daddy plays a record called “Jazz Baby,” the whole family gets into the music, including baby. Full of rhythm and bounce, the text rejoices in the sound of jazz. The retro illustrations add to this celebration of music and family.","Harcourt","2007",,,"Lisa Wheeler","R. Gregory Christie","Preschool/Pre thru K, K thru 2","English","Fiction in Verse","Picture Book, Read Aloud",,"Music","Visual and Performing Arts","VAPA M PreK-12.2, VAPA M PreK-12.4",
"41511","Journey","A young girl, having escaped from her loneliness through a door she drew on her bedroom wall, is captured by an evil emperor and must find a way to escape.","Candlewick","2013",,,"Aaron Becker","Aaron Becker","Preschool/Pre thru K, K thru 2","English","Fiction","Picture Book, Wordless Book",,"English-Language Arts/General","English-Language Arts/General ",,"Caldecott Honor"
"40740","Just a Little Bit","An elephant and a mouse try to play on a seesaw in the park, but the seesaw does not budge. One by one, different animals come along and join mouse on his side of the seesaw, which still does not budge. Finally a tiny beetle lands on the mouse’s nose, and the seesaw moves, allowing the animals to have fun. This cumulative story is enhanced with humorous watercolor artwork. Highlights the value of friendship and of working together.","Houghton Mifflin","1996","1993",,"Ann Tompert","Lynn Munzinger","Preschool/Pre thru K, K thru 2","English","Fiction, Humor","Picture Book, Read Aloud",,"English-Language Arts/General","English-Language Arts/General ",,
"39699","Just One Bite: 11 Animals and Their Bites at Life Size! ","From a tiny worm to a gigantic sperm whale, the sizes of the bites of 11 animals are illustrated and described. Presents a diversity of animals in a variety of ecosystems around the world, all caught in the act of eating a meal. A dot represents how much a worm can eat in one bite, and three drops show how much nectar a butterfly can sip. The grand finale is an all-consuming microorganism that can “eat” even the largest of animals. A good choice for read-aloud.","Chronicle Books","2010","2010",,"Lola Schaefer","Geoff Waring","Preschool/Pre thru K, K thru 2","English","Narrative Nonfiction","Picture Book, Read Aloud",,"Life Science (Biology)","Science","LS 1.2, LS 3.3",
"39722","King Jack and the Dragon","Jack, Zack, and Caspar build a castle fort and then spend a day fighting dragons and beasts. At day’s end, giants first carry away Sir Zack and then Caspar, leaving King Jack to face night creatures alone. An irresistible knights-and-dragons fantasy for the very young, in the tradition of Oxenbury’s enduring classic WE’RE GOING ON A BEAR HUNT.","Dial Books for Young Readers","2011",,,"Peter Bentley","Helen Oxenbury","Preschool/Pre thru K","English","Fantasy, Fiction, Fiction in Verse","Picture Book",,"English-Language Arts/General","English-Language Arts/General , Literacy/Motivation",,
"40437","King’s Taster, The","Meet Max, a beagle wearing glasses, whose role is to taste the royal food to be sure it hasn’t been poisoned and is fit for the king.The cook and his dog have to travel around the world to find recipes to satisfy the new king’s tastes until they discover he’s pigging out on sweets. Pages trimmed in rustic medieval velvets, textile and recipe clip collages, and bright watercolors make this a humorous culinary delight.","HarperCollins","2009",,,"Kenneth Oppel","Lou Fancher, Steve Johnson","Preschool/Pre thru K, K thru 2","English","Fiction","Picture Book, Read Aloud",,"English-Language Arts/General, Nutrition and Physical Activity","Health, English-Language Arts/General ","H K-12.1, H K-12.2",
"40290","Kite Day: A Bear and Mole Story","A giant bear dressed in red overalls determines that today is the perfect spring day to make a kite and fly it with his tiny mole friend. Together the pair shares the responsibilities, and soon they have the yellow kite soaring in the sky. A good read-aloud choice, this book offers large double-page layouts and colorful mixed-media illustrations.","Holiday House","2012",,,"Will Hillenbrand","Will Hillenbrand","Preschool/Pre thru K, K thru 2","English","Fiction","Picture Book, Read Aloud",,"English-Language Arts/General","English-Language Arts/General ",,
"41515","Knock Knock","A boy wakes up one morning to find his father gone. At first, he feels lost. But his father has left him a letter filled with advice to guide him through the times he cannot be there","Little and Brown","2013",,,"Daniel Beaty","Bryan Collier","Preschool/Pre thru K, K thru 2","English","Fiction","Picture Book","Black/African American","English-Language Arts/General","English-Language Arts/General ",,"Coretta Scott King Author Winner"
"40433","Laundry Day","On an early twentieth-century day, a little shoeshine boy looks up to the sky to see clothes dancing on the lines amidst the city tenements. A red scarf floats down, and the boy and his yellow-striped feline companion maneuver to the top of the building to find the owner. They encounter a multitude of culturally diverse residents along the way and celebrate their unique personalities. Readers will be charmed by each character’s features and the detailed movement from panel to panel in the graphic-novel format.","Clarion Books","2012",,,"Maurie J. Manning","Maurie J. Manning","Preschool/Pre thru K, K thru 2","English","Fiction","Graphic Novel","Multicultural","English-Language Arts/General","English-Language Arts/General ",,
"41396","Leaf Can Be, A","A leaf can be a...shade spiller, mouth filler, tree topper, rain stopper. Find out about the many roles leaves play in this poetic exploration of leaves throughout the year. 

","Millbrook Press","2012",,,"Laura Purdie Salas","Violeta Dabija","Preschool/Pre thru K, K thru 2","English","Fiction","Picture Book",,"English-Language Arts/General, Life Science (Biology)","English-Language Arts/General , Science",,"Golden Kite Author Winner"
"41377","Let's Go for a Drive!","Gerald the elephant and Piggie the pig are at it again! This time they decide to go for a drive and begin to list and discuss and shout about all the items needed for this expedition: map, sunglasses, umbrella, and bags. Suddenly, they discover they don't have a car! ","Hyperion Books","2012",,,"Mo Willems","Mo Willems","Preschool/Pre thru K, K thru 2","English","Fiction, Humor","Easy Reader, Read Aloud",,"English-Language Arts/General","English-Language Arts/General , English-Language Arts/Vocabulary",,"Theodor Seuss Geisel Award"
"128","Lily Brown’s Paintings","When young Lily paints, she imagines all sorts of fantastic things in the scenes that she sees every day. Illustrator E. B. Lewis uses watercolor artwork to pay homage to such masters as Van Gogh and Gauguin, and shows Lily’s artwork as childlike and captivating. Use to promote art appreciation and the magic of imagination.
","Orchard","2007",,,"Angela Johnson","E. B. Lewis","Preschool/Pre thru K, K thru 2","English","Fiction","Picture Book, Read Aloud","Black/African American","Visual Arts","Visual and Performing Arts","VAPA V PreK-12.3, VAPA V PreK-12.4",
"39753","Lion and the Mouse, The","A wordless adaptation of the Aesop fable that features a small mouse who is captured and suddenly released by a lion; in turn, the mouse gnaws through a rope to free the lion when he is trapped. Pinkney’s art features a background of the African Serengeti rendered in watercolors of such detail and splendor that the animals virtually come alive. In a closing note, the artist talks about his choice to forgo text.","Little, Brown and Company","2009",,,"Jerry Pinkney","Jerry Pinkney","Preschool/Pre thru K, K thru 2","English","Fable","Picture Book, Wordless Book",,"English-Language Arts/General, Visual Arts, World Cultures: Perspectives, Practices, and Products","World Language, English-Language Arts/General , Literacy/Motivation",,"Caldecott Winner"
"40424","Little Mouse Gets Ready: A Toon Book","Meet Little Mouse on the cover, open to the title page, and see the barn Little Mouse is about to visit. As he deals with the intricacies of getting dressed, his thoughts turn to the treasures the barn has to offer—places to run and hide; the cow’s water, where he can swim; and yummy seeds and oats on the floor. This graphic “Toon Book” features frames, dialogue balloons, witty text, realistic illustrations, and a clever twist at the end.","Toon Books","2009",,,"Jeff Smith","Jeff Smith","Preschool/Pre thru K, K thru 2","English","Fiction","Graphic Novel, Picture Book",,"English-Language Arts/General","English-Language Arts/General ",,"Theodor Seuss Geisel Award"
"746","Little Red Hen, The","A newly illustrated edition of the classic fable of the hen that is forced to do all the work of baking bread and of the lazy animals that learn a bitter lesson from it. This classic tale, with its message of fairness, is made fresh by the dramatic illustrations, subtle humor, and the recognition of each animal’s special attributes.","Dial Books for Young Readers","2006",,,"Jerry Pinkney","Jerry Pinkney","Preschool/Pre thru K, K thru 2","English","Fiction, Folklore","Picture Book, Read Aloud",,"Economics, English-Language Arts/General","History/Social Science","HSS K.1, HSS 1.6",
"41414","Little Roja Riding Hood","While Roja picks flowers on the way to her grandma’s, a mean wolf sneaks away with her cape to surprise Abuelita. But Grandma’s no fool and Roja’s no ordinary chica. They send that hungry lobo packing with a caliente surprise!
","G.P. Putnam's Sons","2014",,,"Susan Middleton Elya","Susan L. Guevara","Preschool/Pre thru K, K thru 2","English","Fiction","Picture Book","Latino/Latino American","English-Language Arts/General","English-Language Arts/General ",,"Pura Belpre Illustration Honor"
"39728","Little Treasures: Endearments from Around the World","Parents often use terms of endearment to refer to their children. This book covers terms of endearment used in 16 different cultures, starting with the United States. Each term is presented in its native language with a pronunciation guide and a simple translation. Illustrated with lively artwork done in ink, watercolor, and gouache.","Houghton Mifflin","2011",,,"Jacqueline K. Ogburn","Chris Raschka","Preschool/Pre thru K, K thru 2","English","Fiction","Picture Book","Multicultural","Diversity, English-Language Arts/General, World Cultures: Perspectives, Practices, and Products","English-Language Arts/General ",,
"39734","Little White Rabbit","As a little white rabbit hops along, he wonders about many things, such as what it is like to be green as the grass or tall as the trees. The book’s pencil-and-acrylic illustrations are in soft pastel colors that are fresh and reminiscent of spring, enhancing the gentle, comforting story.","Greenwillow Books","2011",,,"Kevin Henkes","Kevin Henkes","Preschool/Pre thru K, K thru 2","English","Fiction","Picture Book",,"English-Language Arts/General","English-Language Arts/General ",,
"40499","LMNO Peas","This creative alphabet book uses peas as characters who introduce occupations or hobbies, beginning with acrobats, artists, and astronauts, and ending with zoologists. Each bright letter nearly fills the page and is surrounded by peas engaged in activities that match the letter. An entertaining presentation of the alphabet.","Beach Lane Books","2010",,,"Keith Baker","Keith Baker","Preschool/Pre thru K, K thru 2","English","Fiction","Alphabet Book, Picture Book",,"English-Language Arts/General","Literacy/Motivation",,
"40657","Look! A Book!","This book has an abundance of rhyming nouns, peepholes, and double-page scenes. The colorful, action-packed illustrations entice readers to participate in the seek-and-find adventure. Readers are encouraged to search for numerous objects on each page.","Little, Brown and Company","2011",,,"Bob Staake","Bob Staake","Preschool/Pre thru K, K thru 2","English","Fiction","Picture Book, Read Aloud",,"English-Language Arts/General","English-Language Arts/General , Literacy/Motivation",,
"41520","Los Gatos Black","With rhyming text about Halloween night incorporates Spanish words, from las brujas riding their broomsticks to los monstruos whose monstrous ball is interrupted by a true horror, this story is a fun read! ","Henry Holt","2006",,,"Marisa Montes","Yuyi Morales","Preschool/Pre thru K, K thru 2","English","Poetry","Picture Book","Latino/Latino American","English-Language Arts/General","English-Language Arts/General ",,"Coretta Scott King Author Honor, Coretta Scott King Illustrator Winner"
"40154","Loud Book!, The","A charming cast of stuffed-animal characters represent different types of loud noises as good, bad, embarrassing, deafening, maddening, or even silent. Illustrations of day and night and brief text on each page allow readers to recognize sounds and scenes. Sequel to THE QUIET BOOK.","Houghton Mifflin Harcourt","2011",,,"Deborah Underwood","Renata Liwska","Preschool/Pre thru K, K thru 2","English","Fiction","Picture Book, Read Aloud",,"English-Language Arts/General","English-Language Arts/General ",,
